{
  "schema_version": 1,
  "scenario_id": "scenario.phase0_production",
  "scenario_hash": "sha256:10aa5c8a2dd8a5c79a5902e74f4e55a1ca3ab46a2d35c9bf3dd25fc729dbb07a",
  "constants_hash": "sha256:269fb1545b7a3418c0533cbfc6584f0e46ad83f27f4d65be82cbebbea655a6dd",
  "run_count": 300,
  "values": [
    {
      "policy_id": "chaos.phase0",
      "milestone_id": "milestone.first_manual",
      "statistic": "p50",
      "value_ms": 600000
    },
    {
      "policy_id": "chaos.phase0",
      "milestone_id": "milestone.first_manual",
      "statistic": "p95",
      "value_ms": 1500000
    },
    {
      "policy_id": "chaos.phase0",
      "milestone_id": "milestone.first_generator_purchase",
      "statistic": "p50",
      "value_ms": 1800000
    },
    {
      "policy_id": "chaos.phase0",
      "milestone_id": "milestone.first_generator_purchase",
      "statistic": "p95",
      "value_ms": 4200000
    },
    {
      "policy_id": "chaos.phase0",
      "milestone_id": "milestone.generator_count_1",
      "statistic": "p50",
      "value_ms": 1800000
    },
    {
      "policy_id": "chaos.phase0",
      "milestone_id": "milestone.generator_count_1",
      "statistic": "p95",
      "value_ms": 4200000
    },
    {
      "policy_id": "chaos.phase0",
      "milestone_id": "milestone.t0_progress_1",
      "statistic": "p50",
      "value_ms": 2400000
    },
    {
      "policy_id": "chaos.phase0",
      "milestone_id": "milestone.t0_progress_1",
      "statistic": "p95",
      "value_ms": 4800000
    },
    {
      "policy_id": "casual.phase0",
      "milestone_id": "milestone.first_manual",
      "statistic": "p50",
      "value_ms": 0
    },
    {
      "policy_id": "casual.phase0",
      "milestone_id": "milestone.first_manual",
      "statistic": "p95",
      "value_ms": 0
    },
    {
      "policy_id": "casual.phase0",
      "milestone_id": "milestone.first_generator_purchase",
      "statistic": "p50",
      "value_ms": 10000
    },
    {
      "policy_id": "casual.phase0",
      "milestone_id": "milestone.first_generator_purchase",
      "statistic": "p95",
      "value_ms": 10000
    },
    {
      "policy_id": "casual.phase0",
      "milestone_id": "milestone.generator_count_1",
      "statistic": "p50",
      "value_ms": 10000
    },
    {
      "policy_id": "casual.phase0",
      "milestone_id": "milestone.generator_count_1",
      "statistic": "p95",
      "value_ms": 10000
    },
    {
      "policy_id": "casual.phase0",
      "milestone_id": "milestone.t0_progress_1",
      "statistic": "p50",
      "value_ms": 337000
    },
    {
      "policy_id": "casual.phase0",
      "milestone_id": "milestone.t0_progress_1",
      "statistic": "p95",
      "value_ms": 337000
    }
  ],
  "warnings": [],
  "failures": []
}
